{
  "captured_at": "2026-10-18T16:37:23.812550+00:00",
  "cleanup": {
    "status": "NOT_APPLICABLE"
  },
  "credential_digest": "sha256:b27033322a421fcdbf7c8a2f5347a34715a37b1798c3bda1cf1dd39e781909a3",
  "credential_source": "file:path:29f247d18d3c",
  "errors": [],
  "execution_host": "mac.lan",
  "identity": {
    "id": 6,
    "username": "spyroot",
    "web_url": "https://gitlab.dcloud.run/spyroot"
  },
  "kind": "gitlab_runner",
  "mutated": true,
  "operation": "tag",
  "origin": "https://gitlab.dcloud.run",
  "phase": "APPLY",
  "plan": {
    "body_sha256": "bde0f2b4cc57cbb78d01e0ccc0a32ce67a3ee49da1aaba2d3f257fd120f38abe",
    "confirmation_ready": true,
    "fields": [
      "tag_list"
    ],
    "one_time_sink_required": false,
    "operation": "tag",
    "plan_digest": "6594ed1cc53ff4f9ab845e397a50720834d1bdf491b7ee782b9d27ca673a7351",
    "project_ids": null,
    "requested_tags": [
      "ci-skills",
      "3570e1b7"
    ],
    "resource_id": 92,
    "target_kind": "project",
    "target_reference": "hott/test"
  },
  "plan_digest": "6594ed1cc53ff4f9ab845e397a50720834d1bdf491b7ee782b9d27ca673a7351",
  "readback": {
    "action": "APPLIED",
    "added_tags": [
      "3570e1b7"
    ],
    "after_tags": [
      "ci-skills",
      "3570e1b7"
    ],
    "before_tags": [
      "ci-skills"
    ],
    "id": 92,
    "mutated": true,
    "verified": true
  },
  "records": [
    {
      "action": "APPLIED",
      "added_tags": [
        "3570e1b7"
      ],
      "after_tags": [
        "ci-skills",
        "3570e1b7"
      ],
      "before_tags": [
        "ci-skills"
      ],
      "id": 92,
      "mutated": true,
      "verified": true
    }
  ],
  "result_action": "APPLIED",
  "schema_version": "1.0",
  "skill": {
    "algorithm": "sha256-tree-v1",
    "consuming_project": {
      "commit": null,
      "source": null
    },
    "digest": "db811e2af1e4ec717956f409933a773429e2f813fb16baf9f8456fe4d54cdb11",
    "file_count": 212,
    "functional_digest": "e5a3d6b3cae147228cddb0fa0b1978c94f3c4cd776ca57113589acd7ef769720",
    "revision": {
      "source": "installer_record",
      "value": "3570e1b7618e34a7d365002735c0df2fcb70667b",
      "verified": true
    }
  },
  "status": "PASS",
  "summary": {
    "error_count": 0,
    "record_count": 1
  },
  "target": {
    "kind": "project",
    "reference": "hott/test"
  },
  "target_file": "path:836cb58faf1c",
  "target_source": "project;argv:--project",
  "tested_revision": "3570e1b7618e34a7d365002735c0df2fcb70667b",
  "verified_target": {
    "full_path": "hott/test",
    "id": 123,
    "kind": "project",
    "web_url": "https://gitlab.dcloud.run/hott/test"
  }
}
