{
  "captured_at": "2026-10-18T12:41:39.958093+00:00",
  "cleanup": {
    "status": "NOT_APPLICABLE"
  },
  "credential_digest": "sha256:b27033322a421fcdbf7c8a2f5347a34715a37b1798c3bda1cf1dd39e781909a3",
  "credential_source": "file:path:29f247d18d3c",
  "errors": [],
  "execution_host": "mac.lan",
  "identity": {
    "id": 6,
    "username": "spyroot",
    "web_url": "https://gitlab.dcloud.run/spyroot"
  },
  "kind": "gitlab_runner",
  "mutated": false,
  "operation": "tag",
  "origin": "https://gitlab.dcloud.run",
  "phase": "APPLY",
  "plan": {
    "body_sha256": "755293fa18590078eb2ccc598bb6743212b181dabb8ca8937f7323f55c1c713a",
    "confirmation_ready": true,
    "fields": [
      "tag_list"
    ],
    "one_time_sink_required": false,
    "operation": "tag",
    "plan_digest": "a2f17a484c597f6b0d22698d54509e490a08c31111195d82cded001fc261087e",
    "project_ids": null,
    "requested_tags": [
      "ci-skills",
      "adfdf07e"
    ],
    "resource_id": 86,
    "target_kind": "project",
    "target_reference": "hott/test"
  },
  "plan_digest": "a2f17a484c597f6b0d22698d54509e490a08c31111195d82cded001fc261087e",
  "readback": {
    "action": "NO_OP",
    "added_tags": [],
    "after_tags": [
      "ci-skills",
      "adfdf07e"
    ],
    "before_tags": [
      "ci-skills",
      "adfdf07e"
    ],
    "id": 86,
    "mutated": false,
    "verified": true
  },
  "records": [
    {
      "action": "NO_OP",
      "added_tags": [],
      "after_tags": [
        "ci-skills",
        "adfdf07e"
      ],
      "before_tags": [
        "ci-skills",
        "adfdf07e"
      ],
      "id": 86,
      "mutated": false,
      "verified": true
    }
  ],
  "result_action": "NO_OP",
  "schema_version": "1.0",
  "skill": {
    "algorithm": "sha256-tree-v1",
    "consuming_project": {
      "commit": null,
      "source": null
    },
    "digest": "63e228e1553fc2146726c56e358d1ccf1e8e8e6222e7a22179e0632c73c6c4fb",
    "file_count": 208,
    "functional_digest": "e24a667a3c38b4f68944b6a82cec11f7a101f6d31433947cdc4e68dd5e5eddc7",
    "revision": {
      "source": "installer_record",
      "value": "adfdf07eddd4825e1d5e1b7a0b49f5eb94205a09",
      "verified": true
    }
  },
  "status": "PASS",
  "summary": {
    "error_count": 0,
    "record_count": 1
  },
  "target": {
    "kind": "project",
    "reference": "hott/test"
  },
  "target_file": "path:8617612df58d",
  "target_source": "project;argv:--project",
  "tested_revision": "adfdf07eddd4825e1d5e1b7a0b49f5eb94205a09",
  "verified_target": {
    "full_path": "hott/test",
    "id": 123,
    "kind": "project",
    "web_url": "https://gitlab.dcloud.run/hott/test"
  }
}
